{
    "fullName":{
        "en":"John Doe"
    },"dateOfBirth":"1990-01-01T00:00:00Z",
    "placeOfBirth":{
        "en": "Slovenia"
    },"fullAddress":{
        "en": "A Great Address 2, 2025 Spicetown"
    }, "studentNumber":"12-345-678",
    "academicYear":"2026",
    "programmeTitle":{
        "en": "Mechanical Engineering"
    },"workload": "PT60H"
}